{
  "schema_version": 1,
  "build": {
    "utc_started": "REQUIRED",
    "utc_ended": null,
    "git_commit": "REQUIRED",
    "dirty_worktree": false,
    "compiler": "REQUIRED",
    "compiler_version": "REQUIRED",
    "cmake_preset": "REQUIRED",
    "cmake_options": {},
    "miniaudio_version": "REQUIRED",
    "qt_version": null,
    "operating_system": "REQUIRED",
    "kernel": "REQUIRED",
    "architecture": "REQUIRED",
    "redacted_host_id": "REQUIRED",
    "session_platform": "cli"
  },
  "configuration": {
    "audio_backend": "REQUIRED",
    "playback_identity": "REQUIRED",
    "identity_persistence": "unknown",
    "identity_collision": false,
    "selected_channel": 0,
    "channel_count": 1,
    "negotiated_rate": null,
    "negotiated_format": null,
    "negotiated_channels": null,
    "negotiated_period_frames": null,
    "ptt_provider": "REQUIRED",
    "ptt_address": "REQUIRED_LITERAL_LOOPBACK",
    "ptt_port": 1,
    "flrig_path": null,
    "radio_manufacturer": "OPERATOR_REQUIRED",
    "radio_model": "OPERATOR_REQUIRED",
    "radio_firmware": null,
    "audio_interface": "OPERATOR_REQUIRED",
    "cabling": "OPERATOR_REQUIRED",
    "test_arrangement": "OPERATOR_REQUIRED",
    "radio_mode": "OPERATOR_REQUIRED",
    "frequency": "OPERATOR_REQUIRED",
    "power": "OPERATOR_REQUIRED",
    "vox_state": "OPERATOR_REQUIRED",
    "compressor_state": "OPERATOR_REQUIRED",
    "timeout_state": "OPERATOR_REQUIRED",
    "antenna_state": "OPERATOR_REQUIRED",
    "sstv_mode": "robot-36",
    "fixture_sha256": "2ab0388b27325de68bdb3246cb4eaa043ba85bf27d65f3aebb5d0ba164cbc9d2",
    "fsk_id_enabled": false,
    "duration_nanoseconds": 36910000000,
    "frame_count": 1771680,
    "gain_dbfs": -60,
    "pre_key_ms": 250,
    "post_audio_ms": 250,
    "instrument": null,
    "calibration_method": null
  },
  "stages": [
    {"stage":"manifest","state":"not-run","source":"not-measured","started_utc":null,"ended_utc":null,"skipped_reason":null,"primary_error":null,"cleanup_errors":[],"final_ptt_certainty":null,"measurements":{},"operator_radio_state":null},
    {"stage":"discovery","state":"not-run","source":"not-measured","started_utc":null,"ended_utc":null,"skipped_reason":null,"primary_error":null,"cleanup_errors":[],"final_ptt_certainty":null,"measurements":{},"operator_radio_state":null},
    {"stage":"audio-calibration","state":"not-run","source":"not-measured","started_utc":null,"ended_utc":null,"skipped_reason":null,"primary_error":null,"cleanup_errors":[],"final_ptt_certainty":null,"measurements":{},"operator_radio_state":null},
    {"stage":"ptt-unkey","state":"not-run","source":"not-measured","started_utc":null,"ended_utc":null,"skipped_reason":null,"primary_error":null,"cleanup_errors":[],"final_ptt_certainty":null,"measurements":{},"operator_radio_state":null},
    {"stage":"keyed-silence","state":"not-run","source":"not-measured","started_utc":null,"ended_utc":null,"skipped_reason":null,"primary_error":null,"cleanup_errors":[],"final_ptt_certainty":null,"measurements":{},"operator_radio_state":null},
    {"stage":"full-sstv","state":"not-run","source":"not-measured","started_utc":null,"ended_utc":null,"skipped_reason":null,"primary_error":null,"cleanup_errors":[],"final_ptt_certainty":null,"measurements":{},"operator_radio_state":null},
    {"stage":"controlled-fault","state":"not-run","source":"not-measured","started_utc":null,"ended_utc":null,"skipped_reason":null,"primary_error":null,"cleanup_errors":[],"final_ptt_certainty":null,"measurements":{},"operator_radio_state":null},
    {"stage":"gui-compositor","state":"not-run","source":"not-measured","started_utc":null,"ended_utc":null,"skipped_reason":null,"primary_error":null,"cleanup_errors":[],"final_ptt_certainty":null,"measurements":{},"operator_radio_state":null}
  ],
  "artifacts": [
    {"name":"robot-36-reference.png","sha256":"1676228514e96b46f144f05875ec7c74e3e16dca4d98291ea7f5d93658c1a1b7","bytes":48521,"raw_audio":false}
  ],
  "limitations": ["No physical HIL evidence is present in this template."],
  "operator_notes": null
}
